{
  "$schema": "./target_config.schema.json",
  "name": "ISSF 10m Air Pistol",
  "target": {
    "widthMm": 170,
    "heightMm": 170,
    "centerXmm": 85,
    "centerYmm": 85,
    "distanceM": 10,
    "warpWidthPx": 1024,
    "warpHeightPx": 1024
  },
  "markers": {
    "dictionary": "DICT_4X4_50",
    "ids": { "topLeft": 0, "topRight": 1, "bottomRight": 2, "bottomLeft": 3 },
    "sizeMm": 26,
    "borderBits": 1
  },
  "rings": [
    { "label": "X",    "diameterMm": 5.0,  "score": 10.9 },
    { "label": "10",   "diameterMm": 11.5, "score": 10 },
    { "label": "9",    "diameterMm": 27.5, "score": 9 },
    { "label": "8",    "diameterMm": 43.5, "score": 8 },
    { "label": "7",    "diameterMm": 59.5, "score": 7 },
    { "label": "6",    "diameterMm": 75.5, "score": 6 },
    { "label": "5",    "diameterMm": 91.5, "score": 5 },
    { "label": "4",    "diameterMm": 107.5, "score": 4 },
    { "label": "3",    "diameterMm": 123.5, "score": 3 },
    { "label": "2",    "diameterMm": 139.5, "score": 2 },
    { "label": "1",    "diameterMm": 155.5, "score": 1 }
  ],
  "bullet": {
    "caliberMm": 4.5,
    "breakTheLine": true,
    "minHoleAreaPx": 20,
    "maxHoleAreaPx": 3000,
    "maxAspectRatio": 2.6
  },
  "trigger": {
    "threshold": 0.14,
    "minThreshold": 0.02,
    "maxThreshold": 0.9,
    "shotDelayMs": 70,
    "cooldownMs": 650,
    "rmsWindow": 96
  },
  "morph": {
    "blurKernel": 5,
    "thresholdMethod": "otsu",
    "fixedThreshold": 28,
    "closeKernel": 3,
    "diffScale": 0.6,
    "darknessMax": 120
  }
}
